{
  "id": "shared-workloads-runner",
  "purpose": "calibration",
  "control_ids": [
    "AC-01",
    "AC-02",
    "AC-04"
  ],
  "recorded_on": "2026-10-11",
  "hardware": {
    "class": "github-hosted-runner",
    "cpu_model": "unrecorded (standard x64 runner, 4 vCPU)",
    "cores": 4,
    "threads": 4,
    "memory_gib": 16,
    "os_family": "Ubuntu 24.04",
    "kernel_major": 6
  },
  "toolchains": {
    "image": "ubuntu-24.04 20261004.327",
    "python": "3.14 (actions/setup-python)"
  },
  "conditions": "One hosted run of the identical workload; the factor uses medians.",
  "workloads": [
    {
      "id": "design-unittest",
      "description": "tools/tests unittest suite (211 tests) at commit 398d2f6, Design contracts run 38095157811",
      "command": "make design-check",
      "metric": "wall time reported by unittest",
      "unit": "s",
      "samples": [
        28.413
      ],
      "median": 28.413
    },
    {
      "id": "design-pytest",
      "description": "scripts/tests pytest suite (30 tests) at commit 398d2f6, Design contracts run 38095157811",
      "command": "make design-check",
      "metric": "wall time reported by pytest",
      "unit": "s",
      "samples": [
        3.73
      ],
      "median": 3.73
    }
  ]
}
